{
    "title": "\\[TED talk/Trap\\]",
    "tags": [],
    "lyrics": [],
    "id": "ted-talk-trap",
    "bpm": 92,
    "profile": "Processed Reality / Street-Born Fate",
    "metrics": {
        "density": [
            50,
            50,
            50,
            50,
            50,
            50,
            50,
            50
        ],
        "intensity": [
            50,
            50,
            50,
            50,
            50,
            50,
            50,
            50
        ]
    },
    "mix": {
        "drums": 80,
        "bass": 80,
        "vocals": 100,
        "fx": 50
    },
    "visuals": [
        {
            "time": "0:00",
            "event": "Initialization",
            "desc": "Default visual protocol engaged."
        }
    ]
}