{
    "title": "1\\. The Boom\\-Bap Blueprint: Trauma as Metrical Truth",
    "tags": [
        "The Anapestic Anchor and Semantic Density",
        "Scenario: Mythologizing the Margins",
        "Seuss\\-Infused Boom\\-Bap Flow",
        "Synthesis: The Grit Gospel"
    ],
    "lyrics": [],
    "id": "1-the-boom-bap-blueprint-trauma-as-metrical-truth",
    "bpm": 92,
    "profile": "Processed Reality / Street-Born Fate",
    "metrics": {
        "density": [
            50,
            50,
            50,
            50,
            50,
            50,
            50,
            50
        ],
        "intensity": [
            50,
            50,
            50,
            50,
            50,
            50,
            50,
            50
        ]
    },
    "mix": {
        "drums": 80,
        "bass": 80,
        "vocals": 100,
        "fx": 50
    },
    "visuals": [
        {
            "time": "0:00",
            "event": "Initialization",
            "desc": "Default visual protocol engaged."
        }
    ]
}