{
    "title": "Unlocking Hidden Power: A Deep Dive into Free Advanced Digital Tools for Creators",
    "tags": [
        "Works cited"
    ],
    "lyrics": [],
    "id": "unlocking-hidden-power-a-deep-dive-into-free-advanced-digital-tools-for-creators",
    "bpm": 92,
    "profile": "Processed Reality / Street-Born Fate",
    "metrics": {
        "density": [
            50,
            50,
            50,
            50,
            50,
            50,
            50,
            50
        ],
        "intensity": [
            50,
            50,
            50,
            50,
            50,
            50,
            50,
            50
        ]
    },
    "mix": {
        "drums": 80,
        "bass": 80,
        "vocals": 100,
        "fx": 50
    },
    "visuals": [
        {
            "time": "0:00",
            "event": "Initialization",
            "desc": "Default visual protocol engaged."
        }
    ]
}