{
    "title": "__Chapter 1: The Art of Lyric and Prompt Structuring__",
    "tags": [
        "__1\\.1 The Function of Lyric and Prompt Structuring__",
        "__What is Lyric Structuring?__",
        "__How is it Used?__",
        "__Why is it Important?__",
        "__Chapter 2: Advanced Techniques and Refinement__",
        "__2\\.1 Crafting Complex Musical Directions__",
        "__What are Advanced Techniques?__",
        "__How are They Used?__",
        "__Why are They Important?__",
        "__2\\.2 Mastering Song Length with Extensions and Pacing__",
        "__What are Extensions?__",
        "__How are They Used?__",
        "__Why are They Important?__"
    ],
    "lyrics": [],
    "id": "chapter-1-the-art-of-lyric-and-prompt-structuring",
    "bpm": 92,
    "profile": "Processed Reality / Street-Born Fate",
    "metrics": {
        "density": [
            50,
            50,
            50,
            50,
            50,
            50,
            50,
            50
        ],
        "intensity": [
            50,
            50,
            50,
            50,
            50,
            50,
            50,
            50
        ]
    },
    "mix": {
        "drums": 80,
        "bass": 80,
        "vocals": 100,
        "fx": 50
    },
    "visuals": [
        {
            "time": "0:00",
            "event": "Initialization",
            "desc": "Default visual protocol engaged."
        }
    ]
}