{
    "title": "AI Directive: The Vault Content Update",
    "tags": [
        "Context",
        "Technical Stack",
        "The Task",
        "Data Schema Requirements",
        "Implementation Rules",
        "Input Data"
    ],
    "lyrics": [],
    "id": "ai-directive-the-vault-content-update",
    "bpm": 92,
    "profile": "Processed Reality / Street-Born Fate",
    "metrics": {
        "density": [
            50,
            50,
            50,
            50,
            50,
            50,
            50,
            50
        ],
        "intensity": [
            50,
            50,
            50,
            50,
            50,
            50,
            50,
            50
        ]
    },
    "mix": {
        "drums": 80,
        "bass": 80,
        "vocals": 100,
        "fx": 50
    },
    "visuals": [
        {
            "time": "0:00",
            "event": "Initialization",
            "desc": "Default visual protocol engaged."
        }
    ]
}