{
    "title": "\ud83c\udfb6 The Process of Rhythmic Transfer: From Stability to Liminality",
    "tags": [
        "1\\. The Stability Phase \\(Book 1\\)",
        "2\\. The Disruption and Layering Phases \\(Books 2 & 3\\)",
        "\ud83c\udf99\ufe0f Ideological Divergence: The Anchor Repurposed \\(Book 4\\)"
    ],
    "lyrics": [],
    "id": "the-process-of-rhythmic-transfer-from-stability-to-liminality",
    "bpm": 92,
    "profile": "Processed Reality / Street-Born Fate",
    "metrics": {
        "density": [
            50,
            50,
            50,
            50,
            50,
            50,
            50,
            50
        ],
        "intensity": [
            50,
            50,
            50,
            50,
            50,
            50,
            50,
            50
        ]
    },
    "mix": {
        "drums": 80,
        "bass": 80,
        "vocals": 100,
        "fx": 50
    },
    "visuals": [
        {
            "time": "0:00",
            "event": "Initialization",
            "desc": "Default visual protocol engaged."
        }
    ]
}