{
    "id": "neon-nights",
    "title": "Neon Nights",
    "bpm": 92,
    "profile": "Processed Reality / Street-Born Fate",
    "tags": [
        "synthwave",
        "cyberpunk"
    ],
    "metrics": {
        "density": [
            50,
            50,
            50,
            50,
            50,
            50,
            50,
            50
        ],
        "intensity": [
            50,
            50,
            50,
            50,
            50,
            50,
            50,
            50
        ]
    },
    "mix": {
        "drums": 80,
        "bass": 80,
        "vocals": 100,
        "fx": 50
    },
    "lyrics": [
        {
            "section": "Verse 1",
            "text": "Walking down the street / Lights are flashing",
            "note": ""
        },
        {
            "section": "Chorus",
            "text": "Neon nights, hold me tight",
            "note": "Extracted via Ingest Pipeline"
        }
    ],
    "visuals": [
        {
            "time": "0:00",
            "event": "Initialization",
            "desc": "Default visual protocol engaged."
        }
    ]
}